{
  "schema_version": 1,
  "record_count": 15,
  "source_ids": [
    "fixture.istanbul.v1"
  ],
  "slide_ids": [
    "slide-001",
    "slide-002",
    "slide-003",
    "slide-004",
    "slide-005",
    "slide-006",
    "slide-007"
  ],
  "content_hash": "415403c2b5aff9f0ec00dced689605c304d841d5473dde2982dbbd43861ffa19",
  "records": [
    {
      "claim_id": "fixture.istanbul.v1:c001:29085b405b36",
      "source_id": "fixture.istanbul.v1",
      "span": {
        "start": 0,
        "end": 15
      },
      "claim": "Europe/Istanbul",
      "slide_id": "slide-001",
      "transform": "visualized",
      "approval_state": "approved",
      "source_client_session_id": "session-istanbul",
      "content_hash": "29085b405b361886748ff2ea3274b97ffa0227094ec7738f84449352fb49f3fd"
    },
    {
      "claim_id": "fixture.istanbul.v1:c002:0e5d1a3523e1",
      "source_id": "fixture.istanbul.v1",
      "span": {
        "start": 17,
        "end": 132
      },
      "claim": "Istanbul serves as Turkey's bridge between Europe and Asia, straddling both continents across the Bosphorus Strait.",
      "slide_id": "slide-002",
      "transform": "visualized",
      "approval_state": "approved",
      "source_client_session_id": "session-istanbul",
      "content_hash": "0e5d1a3523e180a124fd5c1a491074f2bfccf009c22b6533cbcd5e4a9ca96d56"
    },
    {
      "claim_id": "fixture.istanbul.v1:c003:c4b35bac4494",
      "source_id": "fixture.istanbul.v1",
      "span": {
        "start": 133,
        "end": 241
      },
      "claim": "Historically known as Byzantium and Constantinople, it was the capital of the Byzantine and Ottoman empires.",
      "slide_id": "slide-003",
      "transform": "visualized",
      "approval_state": "approved",
      "source_client_session_id": "session-istanbul",
      "content_hash": "c4b35bac4494b83db03f8d3a61c2924a63e66e0e27ec38adce68d9a94236217e"
    },
    {
      "claim_id": "fixture.istanbul.v1:c004:dbcaf1db2730",
      "source_id": "fixture.istanbul.v1",
      "span": {
        "start": 242,
        "end": 335
      },
      "claim": "Today, Istanbul is Turkey's largest city and economic center, home to over 15 million people.",
      "slide_id": "slide-004",
      "transform": "visualized",
      "approval_state": "approved",
      "source_client_session_id": "session-istanbul",
      "content_hash": "dbcaf1db27302a81ccb34601c94ab685362c3b2d1314b3454d831f8b775e2723"
    },
    {
      "claim_id": "fixture.istanbul.v1:c005:cc0140cef40d",
      "source_id": "fixture.istanbul.v1",
      "span": {
        "start": 336,
        "end": 522
      },
      "claim": "Its strategic position has made it a crucial commercial hub for millennia, while landmarks like the Hagia Sophia, Blue Mosque, and Topkapi Palace reflect its rich multicultural heritage.",
      "slide_id": "slide-005",
      "transform": "visualized",
      "approval_state": "approved",
      "source_client_session_id": "session-istanbul",
      "content_hash": "cc0140cef40d9da3dabfe50bb4976571c1bb7354e4569c32283524b6157dbf02"
    },
    {
      "claim_id": "fixture.istanbul.v1:c006:a6db783827b6",
      "source_id": "fixture.istanbul.v1",
      "span": {
        "start": 523,
        "end": 645
      },
      "claim": "The city remains a vital link between Western and Eastern civilizations, blending modernity with centuries-old traditions.",
      "slide_id": "slide-006",
      "transform": "visualized",
      "approval_state": "approved",
      "source_client_session_id": "session-istanbul",
      "content_hash": "a6db783827b6fbb1d96f55523fc5a40dc120b732a37a261f8138b53ca48417cf"
    },
    {
      "claim_id": "fixture.istanbul.v1:c007:12b5229a4254",
      "source_id": "fixture.istanbul.v1",
      "span": {
        "start": 647,
        "end": 756
      },
      "claim": "İstanbul Türkiye'nin Avrupa ve Asya kıtaları arasındaki köprüsü olarak Boğaz'ın iki yakasında yer almaktadır.",
      "slide_id": "slide-007",
      "transform": "visualized",
      "approval_state": "approved",
      "source_client_session_id": "session-istanbul",
      "content_hash": "12b5229a4254863b92d7100d193765f85d7a914b6abce30256de75ff26408752"
    },
    {
      "claim_id": "fixture.istanbul.v1:c008:9642cef01d3f",
      "source_id": "fixture.istanbul.v1",
      "span": {
        "start": 757,
        "end": 882
      },
      "claim": "Tarih boyunca Bizans ve Konstantinopolis olarak bilinen şehir, Bizans ve Osmanlı imparatorluklarının başkentliğini yapmıştır.",
      "slide_id": "slide-001",
      "transform": "visualized",
      "approval_state": "approved",
      "source_client_session_id": "session-istanbul",
      "content_hash": "9642cef01d3fbbc00b0a565b74a369397770ed7d4b4369675ee53f7e0dee79c1"
    },
    {
      "claim_id": "fixture.istanbul.v1:c009:59a2aca11c63",
      "source_id": "fixture.istanbul.v1",
      "span": {
        "start": 883,
        "end": 981
      },
      "claim": "Günümüzde İstanbul 15 milyondan fazla nüfusuyla Türkiye'nin en büyük şehri ve ekonomik merkezidir.",
      "slide_id": "slide-002",
      "transform": "visualized",
      "approval_state": "approved",
      "source_client_session_id": "session-istanbul",
      "content_hash": "59a2aca11c63a93d1e2df302c142ab33cdae670ce036fa3ede899e1fa5047e54"
    },
    {
      "claim_id": "fixture.istanbul.v1:c010:0710c73971d0",
      "source_id": "fixture.istanbul.v1",
      "span": {
        "start": 982,
        "end": 1164
      },
      "claim": "Stratejik konumu binlerce yıldır önemli bir ticaret merkezi olmasını sağlarken Ayasofya, Sultanahmet Camii ve Topkapı Sarayı gibi yapılar zengin çok kültürlü mirasını yansıtmaktadır.",
      "slide_id": "slide-003",
      "transform": "visualized",
      "approval_state": "approved",
      "source_client_session_id": "session-istanbul",
      "content_hash": "0710c73971d00ffd6e0ea3ca8f8d08ab767d87f95c7a59b67f8b7797f113bca5"
    },
    {
      "claim_id": "fixture.istanbul.v1:c011:ec91565a5543",
      "source_id": "fixture.istanbul.v1",
      "span": {
        "start": 1165,
        "end": 1319
      },
      "claim": "Şehir modernlik ile yüzyıllar boyunca süregelen gelenekleri harmanlayarak Batı ve Doğu medeniyetleri arasında hayati bir bağlantı olmaya devam etmektedir.",
      "slide_id": "slide-004",
      "transform": "visualized",
      "approval_state": "approved",
      "source_client_session_id": "session-istanbul",
      "content_hash": "ec91565a554358f77070cd2820f2a9332fd95f84c6a39640e535071ceb5b656b"
    },
    {
      "claim_id": "fixture.istanbul.v1:c012:af7d4d9d6bf1",
      "source_id": "fixture.istanbul.v1",
      "span": {
        "start": 1321,
        "end": 1393
      },
      "claim": "伊斯坦布尔作为土耳其连接欧洲和亚洲的桥梁 横跨博斯普鲁斯海峡两岸，分属两个大洲，历史上称为拜占庭和君士坦丁堡，曾是拜占庭帝国和奥斯曼帝国的首都。",
      "slide_id": "slide-005",
      "transform": "visualized",
      "approval_state": "approved",
      "source_client_session_id": "session-istanbul",
      "content_hash": "af7d4d9d6bf18ba6856ffa210229a118905028f4e7cbaafe1f1a758bab569843"
    },
    {
      "claim_id": "fixture.istanbul.v1:c013:cea1b3607226",
      "source_id": "fixture.istanbul.v1",
      "span": {
        "start": 1393,
        "end": 1427
      },
      "claim": "如今伊斯坦布尔是土耳其最大的城市和经济中心，拥有超过1500万人口。",
      "slide_id": "slide-006",
      "transform": "visualized",
      "approval_state": "approved",
      "source_client_session_id": "session-istanbul",
      "content_hash": "cea1b360722600d94508439cd0a0926edb9913e7cdd007dc4b0a87cc8e108379"
    },
    {
      "claim_id": "fixture.istanbul.v1:c014:42e327ed5ab2",
      "source_id": "fixture.istanbul.v1",
      "span": {
        "start": 1427,
        "end": 1487
      },
      "claim": "其战略位置使其数千年来一直是重要的商业中心，而圣索菲亚大教堂、蓝色清真寺和托普卡帕宫等地标则反映了其丰富的多元文化遗产。",
      "slide_id": "slide-007",
      "transform": "visualized",
      "approval_state": "approved",
      "source_client_session_id": "session-istanbul",
      "content_hash": "42e327ed5ab2d0b519fadc2b62993d3a086d31f661df4f071067c0a2e75c5055"
    },
    {
      "claim_id": "fixture.istanbul.v1:c015:d73ee93fd72b",
      "source_id": "fixture.istanbul.v1",
      "span": {
        "start": 1487,
        "end": 1525
      },
      "claim": "这座城市仍然是西方与东方文明之间的重要纽带，将现代性与数百年的传统融为一体。",
      "slide_id": "slide-001",
      "transform": "visualized",
      "approval_state": "approved",
      "source_client_session_id": "session-istanbul",
      "content_hash": "d73ee93fd72b04e54fba952d0772c91221e8f181a888e4780fae004e6f8606d6"
    }
  ]
}
